2025-12-19 02:34:16,313 - INFO - Loading RL model from models/ppo_aggressive_final.zip
2025-12-19 02:37:14,092 - INFO - Loading RL model from ../models/ppo_aggressive_final.zip
2025-12-19 02:37:17,149 - INFO - Model loaded
2025-12-19 02:37:17,180 - INFO - Kalshi client initialized
2025-12-19 02:37:17,180 - INFO - Starting RL Trading Bot
2025-12-19 02:37:17,180 - INFO - Mode: PAPER
2025-12-19 02:37:17,180 - INFO - Balance: $10000.00
2025-12-19 02:37:17,180 - INFO - ============================================================
2025-12-19 02:37:17,181 - INFO - 
Iteration 1
2025-12-19 02:37:17,181 - INFO - Outside hours (2:00)
2025-12-19 02:42:17,182 - INFO - 
Iteration 2
2025-12-19 02:42:17,182 - INFO - Outside hours (2:00)
2025-12-19 02:47:17,184 - INFO - 
Iteration 3
2025-12-19 02:47:17,185 - INFO - Outside hours (2:00)
2025-12-19 02:52:17,186 - INFO - 
Iteration 4
2025-12-19 02:52:17,187 - INFO - Outside hours (2:00)
2025-12-19 02:57:17,188 - INFO - 
Iteration 5
2025-12-19 02:57:17,188 - INFO - Outside hours (2:00)
2025-12-19 03:02:17,190 - INFO - 
Iteration 6
2025-12-19 03:02:17,191 - INFO - Outside hours (3:00)
2025-12-19 03:07:17,193 - INFO - 
Iteration 7
2025-12-19 03:07:17,193 - INFO - Outside hours (3:00)
2025-12-19 03:12:17,194 - INFO - 
Iteration 8
2025-12-19 03:12:17,194 - INFO - Outside hours (3:00)
2025-12-19 03:17:17,196 - INFO - 
Iteration 9
2025-12-19 03:17:17,197 - INFO - Outside hours (3:00)
2025-12-19 03:22:17,202 - INFO - 
Iteration 10
2025-12-19 03:22:17,203 - INFO - Outside hours (3:00)
2025-12-19 03:27:17,205 - INFO - 
Iteration 11
2025-12-19 03:27:17,206 - INFO - Outside hours (3:00)
2025-12-19 03:32:17,207 - INFO - 
Iteration 12
2025-12-19 03:32:17,207 - INFO - Outside hours (3:00)
2025-12-19 03:37:17,208 - INFO - 
Iteration 13
2025-12-19 03:37:17,209 - INFO - Outside hours (3:00)
2025-12-19 03:42:17,210 - INFO - 
Iteration 14
2025-12-19 03:42:17,210 - INFO - Outside hours (3:00)
2025-12-19 03:46:39,510 - INFO - 
Stopped by user
2025-12-19 03:46:39,511 - INFO - 
Total Trades: 0
2025-12-19 03:46:39,512 - INFO - Final Balance: $10000.00
2025-12-19 04:02:03,777 - INFO - Loading RL model from ../models/ppo_aggressive_final.zip
2025-12-19 04:02:06,093 - INFO - Model loaded
2025-12-19 04:02:06,129 - INFO - Kalshi client initialized
2025-12-19 04:02:06,129 - INFO - ============================================================
2025-12-19 04:02:06,129 - INFO - STARTING RL TRADING BOT - TEST MODE
2025-12-19 04:02:06,130 - INFO - Mode: PAPER TRADING
2025-12-19 04:02:06,130 - INFO - Initial Balance: $10000.00
2025-12-19 04:02:06,130 - INFO - Max Iterations: 10
2025-12-19 04:02:06,130 - INFO - ============================================================
2025-12-19 04:02:06,130 - INFO - 
============================================================
2025-12-19 04:02:06,130 - INFO - ITERATION 1/10
2025-12-19 04:02:06,130 - INFO - ============================================================
2025-12-19 04:02:06,413 - INFO - Found 10 BTC markets
2025-12-19 04:02:06,413 - INFO - Market: KXBTC-25DEC1917-T96749.99
2025-12-19 04:02:06,414 - INFO -   YES: bid=0c ask=2c
2025-12-19 04:02:06,414 - INFO -   NO:  bid=98c ask=100c
2025-12-19 04:02:06,651 - INFO - Current BTC price: $87,968.59
2025-12-19 04:02:06,651 - INFO - Building price history... (1/24)
2025-12-19 04:02:06,652 - INFO - HOLD - No action taken
2025-12-19 04:02:06,652 - INFO - 
Current Status:
2025-12-19 04:02:06,652 - INFO -   Balance: $10000.00
2025-12-19 04:02:06,652 - INFO -   Total Trades: 0
2025-12-19 04:02:06,652 - INFO -   Open Positions: 0
2025-12-19 04:02:06,652 - INFO - 
Sleeping 60s...
2025-12-19 04:03:06,653 - INFO - 
============================================================
2025-12-19 04:03:06,653 - INFO - ITERATION 2/10
2025-12-19 04:03:06,653 - INFO - ============================================================
2025-12-19 04:03:06,929 - INFO - Found 10 BTC markets
2025-12-19 04:03:06,929 - INFO - Market: KXBTC-25DEC1917-T96749.99
2025-12-19 04:03:06,929 - INFO -   YES: bid=0c ask=2c
2025-12-19 04:03:06,930 - INFO -   NO:  bid=98c ask=100c
2025-12-19 04:03:07,187 - INFO - Current BTC price: $87,954.44
2025-12-19 04:03:07,189 - INFO - Building price history... (2/24)
2025-12-19 04:03:07,189 - INFO - HOLD - No action taken
2025-12-19 04:03:07,190 - INFO - 
Current Status:
2025-12-19 04:03:07,190 - INFO -   Balance: $10000.00
2025-12-19 04:03:07,190 - INFO -   Total Trades: 0
2025-12-19 04:03:07,191 - INFO -   Open Positions: 0
2025-12-19 04:03:07,191 - INFO - 
Sleeping 60s...
2025-12-19 04:04:07,192 - INFO - 
============================================================
2025-12-19 04:04:07,192 - INFO - ITERATION 3/10
2025-12-19 04:04:07,193 - INFO - ============================================================
2025-12-19 04:04:07,625 - INFO - Found 10 BTC markets
2025-12-19 04:04:07,626 - INFO - Market: KXBTC-25DEC1917-T96749.99
2025-12-19 04:04:07,626 - INFO -   YES: bid=0c ask=2c
2025-12-19 04:04:07,627 - INFO -   NO:  bid=98c ask=100c
2025-12-19 04:04:08,002 - INFO - Current BTC price: $87,957.99
2025-12-19 04:04:08,005 - INFO - Building price history... (3/24)
2025-12-19 04:04:08,006 - INFO - HOLD - No action taken
2025-12-19 04:04:08,006 - INFO - 
Current Status:
2025-12-19 04:04:08,007 - INFO -   Balance: $10000.00
2025-12-19 04:04:08,007 - INFO -   Total Trades: 0
2025-12-19 04:04:08,007 - INFO -   Open Positions: 0
2025-12-19 04:04:08,009 - INFO - 
Sleeping 60s...
2025-12-19 04:05:08,010 - INFO - 
============================================================
2025-12-19 04:05:08,010 - INFO - ITERATION 4/10
2025-12-19 04:05:08,010 - INFO - ============================================================
2025-12-19 04:05:08,313 - INFO - Found 10 BTC markets
2025-12-19 04:05:08,313 - INFO - Market: KXBTC-25DEC1917-T96749.99
2025-12-19 04:05:08,313 - INFO -   YES: bid=0c ask=2c
2025-12-19 04:05:08,314 - INFO -   NO:  bid=98c ask=100c
2025-12-19 04:05:08,545 - INFO - Current BTC price: $87,919.30
2025-12-19 04:05:08,547 - INFO - Building price history... (4/24)
2025-12-19 04:05:08,547 - INFO - HOLD - No action taken
2025-12-19 04:05:08,548 - INFO - 
Current Status:
2025-12-19 04:05:08,548 - INFO -   Balance: $10000.00
2025-12-19 04:05:08,548 - INFO -   Total Trades: 0
2025-12-19 04:05:08,549 - INFO -   Open Positions: 0
2025-12-19 04:05:08,549 - INFO - 
Sleeping 60s...
2025-12-19 04:06:08,551 - INFO - 
============================================================
2025-12-19 04:06:08,551 - INFO - ITERATION 5/10
2025-12-19 04:06:08,551 - INFO - ============================================================
2025-12-19 04:06:08,960 - INFO - Found 10 BTC markets
2025-12-19 04:06:08,962 - INFO - Market: KXBTC-25DEC1917-T96749.99
2025-12-19 04:06:08,963 - INFO -   YES: bid=0c ask=2c
2025-12-19 04:06:08,964 - INFO -   NO:  bid=98c ask=100c
2025-12-19 04:06:09,404 - INFO - Current BTC price: $87,944.45
2025-12-19 04:06:09,405 - INFO - Building price history... (5/24)
2025-12-19 04:06:09,406 - INFO - HOLD - No action taken
2025-12-19 04:06:09,406 - INFO - 
Current Status:
2025-12-19 04:06:09,407 - INFO -   Balance: $10000.00
2025-12-19 04:06:09,407 - INFO -   Total Trades: 0
2025-12-19 04:06:09,407 - INFO -   Open Positions: 0
2025-12-19 04:06:09,407 - INFO - 
Sleeping 60s...
2025-12-19 04:07:09,408 - INFO - 
============================================================
2025-12-19 04:07:09,408 - INFO - ITERATION 6/10
2025-12-19 04:07:09,408 - INFO - ============================================================
2025-12-19 04:07:09,828 - INFO - Found 10 BTC markets
2025-12-19 04:07:09,828 - INFO - Market: KXBTC-25DEC1917-T96749.99
2025-12-19 04:07:09,830 - INFO -   YES: bid=0c ask=2c
2025-12-19 04:07:09,830 - INFO -   NO:  bid=98c ask=100c
2025-12-19 04:07:10,237 - INFO - Current BTC price: $87,923.32
2025-12-19 04:07:10,241 - INFO - Building price history... (6/24)
2025-12-19 04:07:10,242 - INFO - HOLD - No action taken
2025-12-19 04:07:10,242 - INFO - 
Current Status:
2025-12-19 04:07:10,242 - INFO -   Balance: $10000.00
2025-12-19 04:07:10,243 - INFO -   Total Trades: 0
2025-12-19 04:07:10,243 - INFO -   Open Positions: 0
2025-12-19 04:07:10,244 - INFO - 
Sleeping 60s...
2025-12-19 04:08:10,247 - INFO - 
============================================================
2025-12-19 04:08:10,250 - INFO - ITERATION 7/10
2025-12-19 04:08:10,256 - INFO - ============================================================
2025-12-19 04:08:10,657 - INFO - Found 10 BTC markets
2025-12-19 04:08:10,658 - INFO - Market: KXBTC-25DEC1917-T96749.99
2025-12-19 04:08:10,659 - INFO -   YES: bid=0c ask=2c
2025-12-19 04:08:10,659 - INFO -   NO:  bid=98c ask=100c
2025-12-19 04:08:11,092 - INFO - Current BTC price: $87,955.55
2025-12-19 04:08:11,094 - INFO - Building price history... (7/24)
2025-12-19 04:08:11,094 - INFO - HOLD - No action taken
2025-12-19 04:08:11,095 - INFO - 
Current Status:
2025-12-19 04:08:11,095 - INFO -   Balance: $10000.00
2025-12-19 04:08:11,095 - INFO -   Total Trades: 0
2025-12-19 04:08:11,095 - INFO -   Open Positions: 0
2025-12-19 04:08:11,096 - INFO - 
Sleeping 60s...
2025-12-19 04:09:11,097 - INFO - 
============================================================
2025-12-19 04:09:11,098 - INFO - ITERATION 8/10
2025-12-19 04:09:11,099 - INFO - ============================================================
2025-12-19 04:09:11,554 - INFO - Found 10 BTC markets
2025-12-19 04:09:11,555 - INFO - Market: KXBTC-25DEC1917-T96749.99
2025-12-19 04:09:11,555 - INFO -   YES: bid=0c ask=2c
2025-12-19 04:09:11,555 - INFO -   NO:  bid=98c ask=100c
2025-12-19 04:09:11,896 - INFO - Current BTC price: $87,930.01
2025-12-19 04:09:11,899 - INFO - Building price history... (8/24)
2025-12-19 04:09:11,900 - INFO - HOLD - No action taken
2025-12-19 04:09:11,901 - INFO - 
Current Status:
2025-12-19 04:09:11,901 - INFO -   Balance: $10000.00
2025-12-19 04:09:11,903 - INFO -   Total Trades: 0
2025-12-19 04:09:11,903 - INFO -   Open Positions: 0
2025-12-19 04:09:11,904 - INFO - 
Sleeping 60s...
2025-12-19 04:10:11,904 - INFO - 
============================================================
2025-12-19 04:10:11,904 - INFO - ITERATION 9/10
2025-12-19 04:10:11,905 - INFO - ============================================================
2025-12-19 04:10:12,240 - INFO - Found 10 BTC markets
2025-12-19 04:10:12,240 - INFO - Market: KXBTC-25DEC1917-T96749.99
2025-12-19 04:10:12,241 - INFO -   YES: bid=0c ask=2c
2025-12-19 04:10:12,241 - INFO -   NO:  bid=98c ask=100c
2025-12-19 04:10:12,456 - INFO - Current BTC price: $87,951.96
2025-12-19 04:10:12,459 - INFO - Building price history... (9/24)
2025-12-19 04:10:12,459 - INFO - HOLD - No action taken
2025-12-19 04:10:12,460 - INFO - 
Current Status:
2025-12-19 04:10:12,460 - INFO -   Balance: $10000.00
2025-12-19 04:10:12,460 - INFO -   Total Trades: 0
2025-12-19 04:10:12,461 - INFO -   Open Positions: 0
2025-12-19 04:10:12,461 - INFO - 
Sleeping 60s...
2025-12-19 04:11:12,462 - INFO - 
============================================================
2025-12-19 04:11:12,462 - INFO - ITERATION 10/10
2025-12-19 04:11:12,463 - INFO - ============================================================
2025-12-19 04:11:12,880 - INFO - Found 10 BTC markets
2025-12-19 04:11:12,882 - INFO - Market: KXBTC-25DEC1917-T96749.99
2025-12-19 04:11:12,882 - INFO -   YES: bid=0c ask=2c
2025-12-19 04:11:12,883 - INFO -   NO:  bid=98c ask=100c
2025-12-19 04:11:13,270 - INFO - Current BTC price: $87,942.26
2025-12-19 04:11:13,273 - INFO - Building price history... (10/24)
2025-12-19 04:11:13,274 - INFO - HOLD - No action taken
2025-12-19 04:11:13,274 - INFO - 
Current Status:
2025-12-19 04:11:13,275 - INFO -   Balance: $10000.00
2025-12-19 04:11:13,277 - INFO -   Total Trades: 0
2025-12-19 04:11:13,278 - INFO -   Open Positions: 0
2025-12-19 04:11:13,279 - INFO - 
============================================================
2025-12-19 04:11:13,279 - INFO - FINAL SUMMARY
2025-12-19 04:11:13,281 - INFO - ============================================================
2025-12-19 04:11:13,282 - INFO - Total Iterations: 10
2025-12-19 04:11:13,282 - INFO - Total Trades Executed: 0
2025-12-19 04:11:13,285 - INFO - Starting Balance: $10000.00
2025-12-19 04:11:13,287 - INFO - Final Balance: $10000.00
2025-12-19 04:11:13,288 - INFO - P&L: $0.00
2025-12-19 04:11:13,289 - INFO - ============================================================
2025-12-19 10:06:38,972 - INFO - Loading RL model from ../models/ppo_aggressive_final.zip
2025-12-19 10:06:41,539 - INFO - Model loaded
2025-12-19 10:06:41,587 - INFO - Kalshi client initialized
2025-12-19 10:06:41,587 - INFO - ============================================================
2025-12-19 10:06:41,587 - INFO - STARTING RL TRADING BOT - TEST MODE
2025-12-19 10:06:41,587 - INFO - Mode: PAPER TRADING
2025-12-19 10:06:41,588 - INFO - Initial Balance: $10000.00
2025-12-19 10:06:41,588 - INFO - Max Iterations: 10
2025-12-19 10:06:41,588 - INFO - ============================================================
2025-12-19 10:06:41,588 - INFO - 
============================================================
2025-12-19 10:06:41,588 - INFO - ITERATION 1/10
2025-12-19 10:06:41,588 - INFO - ============================================================
2025-12-19 10:06:41,893 - INFO - Found 10 BTC markets
2025-12-19 10:06:41,894 - INFO - Market: KXBTC-25DEC1917-T96749.99
2025-12-19 10:06:41,894 - INFO -   YES: bid=0c ask=3c
2025-12-19 10:06:41,894 - INFO -   NO:  bid=97c ask=100c
2025-12-19 10:06:42,130 - INFO - Current BTC price: $88,011.04
2025-12-19 10:06:42,544 - INFO - *** AGENT DECISION: BUY_NO x0 contracts ***
2025-12-19 10:06:42,544 - INFO - HOLD - No action taken
2025-12-19 10:06:42,544 - INFO - 
Current Status:
2025-12-19 10:06:42,544 - INFO -   Balance: $10000.00
2025-12-19 10:06:42,545 - INFO -   Total Trades: 0
2025-12-19 10:06:42,545 - INFO -   Open Positions: 0
2025-12-19 10:06:42,545 - INFO - 
Sleeping 60s...
2025-12-19 10:07:42,545 - INFO - 
============================================================
2025-12-19 10:07:42,545 - INFO - ITERATION 2/10
2025-12-19 10:07:42,545 - INFO - ============================================================
2025-12-19 10:07:42,974 - INFO - Found 10 BTC markets
2025-12-19 10:07:42,974 - INFO - Market: KXBTC-25DEC1917-T96749.99
2025-12-19 10:07:42,975 - INFO -   YES: bid=0c ask=3c
2025-12-19 10:07:42,976 - INFO -   NO:  bid=97c ask=100c
2025-12-19 10:07:43,371 - INFO - Current BTC price: $88,118.76
2025-12-19 10:07:43,380 - INFO - *** AGENT DECISION: BUY_YES x0 contracts ***
2025-12-19 10:07:43,385 - INFO - HOLD - No action taken
2025-12-19 10:07:43,385 - INFO - 
Current Status:
2025-12-19 10:07:43,386 - INFO -   Balance: $10000.00
2025-12-19 10:07:43,387 - INFO -   Total Trades: 0
2025-12-19 10:07:43,388 - INFO -   Open Positions: 0
2025-12-19 10:07:43,388 - INFO - 
Sleeping 60s...
2025-12-19 10:08:43,389 - INFO - 
============================================================
2025-12-19 10:08:43,390 - INFO - ITERATION 3/10
2025-12-19 10:08:43,391 - INFO - ============================================================
2025-12-19 10:08:43,906 - INFO - Found 10 BTC markets
2025-12-19 10:08:43,907 - INFO - Market: KXBTC-25DEC1917-T96749.99
2025-12-19 10:08:43,908 - INFO -   YES: bid=0c ask=3c
2025-12-19 10:08:43,908 - INFO -   NO:  bid=97c ask=100c
2025-12-19 10:08:44,264 - INFO - Current BTC price: $88,154.13
2025-12-19 10:08:44,273 - INFO - *** AGENT DECISION: BUY_YES x0 contracts ***
2025-12-19 10:08:44,274 - INFO - HOLD - No action taken
2025-12-19 10:08:44,275 - INFO - 
Current Status:
2025-12-19 10:08:44,276 - INFO -   Balance: $10000.00
2025-12-19 10:08:44,276 - INFO -   Total Trades: 0
2025-12-19 10:08:44,276 - INFO -   Open Positions: 0
2025-12-19 10:08:44,276 - INFO - 
Sleeping 60s...
2025-12-19 10:09:44,278 - INFO - 
============================================================
2025-12-19 10:09:44,278 - INFO - ITERATION 4/10
2025-12-19 10:09:44,278 - INFO - ============================================================
2025-12-19 10:09:44,752 - INFO - Found 10 BTC markets
2025-12-19 10:09:44,752 - INFO - Market: KXBTC-25DEC1917-T96749.99
2025-12-19 10:09:44,752 - INFO -   YES: bid=0c ask=3c
2025-12-19 10:09:44,754 - INFO -   NO:  bid=97c ask=100c
2025-12-19 10:09:45,245 - INFO - Current BTC price: $88,154.04
2025-12-19 10:09:45,252 - INFO - *** AGENT DECISION: BUY_YES x0 contracts ***
2025-12-19 10:09:45,252 - INFO - HOLD - No action taken
2025-12-19 10:09:45,253 - INFO - 
Current Status:
2025-12-19 10:09:45,253 - INFO -   Balance: $10000.00
2025-12-19 10:09:45,253 - INFO -   Total Trades: 0
2025-12-19 10:09:45,254 - INFO -   Open Positions: 0
2025-12-19 10:09:45,254 - INFO - 
Sleeping 60s...
2025-12-19 10:10:45,255 - INFO - 
============================================================
2025-12-19 10:10:45,257 - INFO - ITERATION 5/10
2025-12-19 10:10:45,257 - INFO - ============================================================
2025-12-19 10:10:45,627 - INFO - Found 10 BTC markets
2025-12-19 10:10:45,628 - INFO - Market: KXBTC-25DEC1917-T96749.99
2025-12-19 10:10:45,629 - INFO -   YES: bid=0c ask=3c
2025-12-19 10:10:45,630 - INFO -   NO:  bid=97c ask=100c
2025-12-19 10:10:46,098 - INFO - Current BTC price: $88,163.63
2025-12-19 10:10:46,103 - INFO - *** AGENT DECISION: BUY_NO x10 contracts ***
2025-12-19 10:10:46,103 - INFO - >>> EXECUTING: BUY 10x NO @ 100c (cost: $10.00)
2025-12-19 10:10:46,104 - INFO - PAPER TRADE - Simulated execution
2025-12-19 10:10:46,104 - INFO - New balance: $9990.00
2025-12-19 10:10:46,104 - INFO - 
Current Status:
2025-12-19 10:10:46,104 - INFO -   Balance: $9990.00
2025-12-19 10:10:46,104 - INFO -   Total Trades: 1
2025-12-19 10:10:46,104 - INFO -   Open Positions: 0
2025-12-19 10:10:46,105 - INFO - 
Sleeping 60s...
2025-12-19 10:11:46,105 - INFO - 
============================================================
2025-12-19 10:11:46,105 - INFO - ITERATION 6/10
2025-12-19 10:11:46,106 - INFO - ============================================================
2025-12-19 10:11:46,549 - INFO - Found 10 BTC markets
2025-12-19 10:11:46,549 - INFO - Market: KXBTC-25DEC1917-T96749.99
2025-12-19 10:11:46,550 - INFO -   YES: bid=0c ask=3c
2025-12-19 10:11:46,550 - INFO -   NO:  bid=97c ask=100c
2025-12-19 10:11:46,933 - INFO - Current BTC price: $88,301.18
2025-12-19 10:11:46,942 - INFO - *** AGENT DECISION: BUY_YES x10 contracts ***
2025-12-19 10:11:46,942 - INFO - >>> EXECUTING: BUY 10x YES @ 3c (cost: $0.30)
2025-12-19 10:11:46,942 - INFO - PAPER TRADE - Simulated execution
2025-12-19 10:11:46,943 - INFO - New balance: $9989.70
2025-12-19 10:11:46,943 - INFO - 
Current Status:
2025-12-19 10:11:46,944 - INFO -   Balance: $9989.70
2025-12-19 10:11:46,944 - INFO -   Total Trades: 2
2025-12-19 10:11:46,944 - INFO -   Open Positions: 0
2025-12-19 10:11:46,945 - INFO - 
Sleeping 60s...
2025-12-19 10:12:46,946 - INFO - 
============================================================
2025-12-19 10:12:46,946 - INFO - ITERATION 7/10
2025-12-19 10:12:46,947 - INFO - ============================================================
2025-12-19 10:12:47,189 - INFO - Found 10 BTC markets
2025-12-19 10:12:47,189 - INFO - Market: KXBTC-25DEC1917-T96749.99
2025-12-19 10:12:47,190 - INFO -   YES: bid=0c ask=3c
2025-12-19 10:12:47,190 - INFO -   NO:  bid=97c ask=100c
2025-12-19 10:12:47,438 - INFO - Current BTC price: $88,412.01
2025-12-19 10:12:47,444 - INFO - *** AGENT DECISION: BUY_NO x10 contracts ***
2025-12-19 10:12:47,444 - INFO - >>> EXECUTING: BUY 10x NO @ 100c (cost: $10.00)
2025-12-19 10:12:47,445 - INFO - PAPER TRADE - Simulated execution
2025-12-19 10:12:47,445 - INFO - New balance: $9979.70
2025-12-19 10:12:47,445 - INFO - 
Current Status:
2025-12-19 10:12:47,446 - INFO -   Balance: $9979.70
2025-12-19 10:12:47,446 - INFO -   Total Trades: 3
2025-12-19 10:12:47,446 - INFO -   Open Positions: 0
2025-12-19 10:12:47,446 - INFO - 
Sleeping 60s...
2025-12-19 10:13:47,447 - INFO - 
============================================================
2025-12-19 10:13:47,447 - INFO - ITERATION 8/10
2025-12-19 10:13:47,448 - INFO - ============================================================
2025-12-19 10:13:47,712 - INFO - Found 10 BTC markets
2025-12-19 10:13:47,712 - INFO - Market: KXBTC-25DEC1917-T96749.99
2025-12-19 10:13:47,713 - INFO -   YES: bid=0c ask=3c
2025-12-19 10:13:47,713 - INFO -   NO:  bid=97c ask=100c
2025-12-19 10:13:47,946 - INFO - Current BTC price: $88,682.69
2025-12-19 10:13:47,952 - INFO - *** AGENT DECISION: BUY_YES x10 contracts ***
2025-12-19 10:13:47,953 - INFO - >>> EXECUTING: BUY 10x YES @ 3c (cost: $0.30)
2025-12-19 10:13:47,953 - INFO - PAPER TRADE - Simulated execution
2025-12-19 10:13:47,953 - INFO - New balance: $9979.40
2025-12-19 10:13:47,954 - INFO - 
Current Status:
2025-12-19 10:13:47,954 - INFO -   Balance: $9979.40
2025-12-19 10:13:47,955 - INFO -   Total Trades: 4
2025-12-19 10:13:47,955 - INFO -   Open Positions: 0
2025-12-19 10:13:47,955 - INFO - 
Sleeping 60s...
2025-12-19 10:14:47,956 - INFO - 
============================================================
2025-12-19 10:14:47,958 - INFO - ITERATION 9/10
2025-12-19 10:14:47,958 - INFO - ============================================================
2025-12-19 10:14:48,245 - INFO - Found 10 BTC markets
2025-12-19 10:14:48,246 - INFO - Market: KXBTC-25DEC1917-T96749.99
2025-12-19 10:14:48,246 - INFO -   YES: bid=0c ask=3c
2025-12-19 10:14:48,246 - INFO -   NO:  bid=97c ask=100c
2025-12-19 10:14:48,475 - INFO - Current BTC price: $88,760.01
2025-12-19 10:14:48,481 - INFO - *** AGENT DECISION: BUY_NO x10 contracts ***
2025-12-19 10:14:48,481 - INFO - >>> EXECUTING: BUY 10x NO @ 100c (cost: $10.00)
2025-12-19 10:14:48,481 - INFO - PAPER TRADE - Simulated execution
2025-12-19 10:14:48,482 - INFO - New balance: $9969.40
2025-12-19 10:14:48,482 - INFO - 
Current Status:
2025-12-19 10:14:48,482 - INFO -   Balance: $9969.40
2025-12-19 10:14:48,482 - INFO -   Total Trades: 5
2025-12-19 10:14:48,482 - INFO -   Open Positions: 0
2025-12-19 10:14:48,483 - INFO - 
Sleeping 60s...
2025-12-19 10:15:48,484 - INFO - 
============================================================
2025-12-19 10:15:48,485 - INFO - ITERATION 10/10
2025-12-19 10:15:48,485 - INFO - ============================================================
2025-12-19 10:15:48,883 - INFO - Found 10 BTC markets
2025-12-19 10:15:48,883 - INFO - Market: KXBTC-25DEC1917-T96749.99
2025-12-19 10:15:48,884 - INFO -   YES: bid=0c ask=3c
2025-12-19 10:15:48,884 - INFO -   NO:  bid=97c ask=100c
2025-12-19 10:15:49,294 - INFO - Current BTC price: $88,810.30
2025-12-19 10:15:49,299 - INFO - *** AGENT DECISION: SELL_NO x10 contracts ***
2025-12-19 10:15:49,300 - INFO - >>> EXECUTING: SELL 10x NO @ 97c (cost: $9.70)
2025-12-19 10:15:49,300 - INFO - PAPER TRADE - Simulated execution
2025-12-19 10:15:49,301 - INFO - New balance: $9959.70
2025-12-19 10:15:49,301 - INFO - 
Current Status:
2025-12-19 10:15:49,302 - INFO -   Balance: $9959.70
2025-12-19 10:15:49,303 - INFO -   Total Trades: 6
2025-12-19 10:15:49,303 - INFO -   Open Positions: 0
2025-12-19 10:15:49,303 - INFO - 
============================================================
2025-12-19 10:15:49,304 - INFO - FINAL SUMMARY
2025-12-19 10:15:49,305 - INFO - ============================================================
2025-12-19 10:15:49,305 - INFO - Total Iterations: 10
2025-12-19 10:15:49,306 - INFO - Total Trades Executed: 6
2025-12-19 10:15:49,306 - INFO - Starting Balance: $10000.00
2025-12-19 10:15:49,306 - INFO - Final Balance: $9959.70
2025-12-19 10:15:49,307 - INFO - P&L: $-40.30
2025-12-19 10:15:49,307 - INFO - ============================================================
